{
  "graph_file": "curriculum-framework/skill-graphs/grade3/reading-english/graph.v1.json",
  "grade": "grade3",
  "subject": "reading-english",
  "version": "v1",
  "checks": [
    {
      "name": "graph_file_exists",
      "pass": true
    },
    {
      "name": "grade_subject_version_present",
      "pass": true
    },
    {
      "name": "domain_codes_unique",
      "pass": true
    },
    {
      "name": "skill_codes_unique",
      "pass": true
    },
    {
      "name": "required_fields_present",
      "pass": true
    },
    {
      "name": "validation_report_exists",
      "pass": true
    },
    {
      "name": "needs_review_preserved",
      "pass": true
    },
    {
      "name": "no_tracking_scoring_db_logic_added",
      "pass": true
    }
  ],
  "unresolved_prerequisites": [
    {
      "type": "unresolved_prerequisite",
      "skill": "G3E_FL_001",
      "token": "g2_accuracy"
    },
    {
      "type": "unresolved_prerequisite",
      "skill": "G3E_FL_001",
      "token": "g2_word_study"
    },
    {
      "type": "unresolved_prerequisite",
      "skill": "G3E_FL_002",
      "token": "accuracy"
    },
    {
      "type": "unresolved_prerequisite",
      "skill": "G3E_FL_002",
      "token": "independent_reading"
    },
    {
      "type": "unresolved_prerequisite",
      "skill": "G3E_FL_003",
      "token": "reading_rate"
    },
    {
      "type": "unresolved_prerequisite",
      "skill": "G3E_FL_003",
      "token": "comprehension"
    },
    {
      "type": "unresolved_prerequisite",
      "skill": "G3E_RC_001",
      "token": "g2_main_idea"
    },
    {
      "type": "unresolved_prerequisite",
      "skill": "G3E_RC_001",
      "token": "g2_comprehension"
    },
    {
      "type": "unresolved_prerequisite",
      "skill": "G3E_RC_002",
      "token": "main_idea"
    },
    {
      "type": "unresolved_prerequisite",
      "skill": "G3E_RC_002",
      "token": "sequence"
    },
    {
      "type": "unresolved_prerequisite",
      "skill": "G3E_RC_003",
      "token": "story_sequence"
    },
    {
      "type": "unresolved_prerequisite",
      "skill": "G3E_RC_003",
      "token": "summarize"
    },
    {
      "type": "unresolved_prerequisite",
      "skill": "G3E_RC_004",
      "token": "comprehension"
    },
    {
      "type": "unresolved_prerequisite",
      "skill": "G3E_RC_004",
      "token": "basic_reasoning"
    },
    {
      "type": "unresolved_prerequisite",
      "skill": "G3E_EI_001",
      "token": "g2_support_answers"
    },
    {
      "type": "unresolved_prerequisite",
      "skill": "G3E_EI_001",
      "token": "fluency"
    },
    {
      "type": "unresolved_prerequisite",
      "skill": "G3E_EI_002",
      "token": "text_evidence"
    },
    {
      "type": "unresolved_prerequisite",
      "skill": "G3E_EI_002",
      "token": "comprehension"
    },
    {
      "type": "unresolved_prerequisite",
      "skill": "G3E_EI_003",
      "token": "simple_inference"
    },
    {
      "type": "unresolved_prerequisite",
      "skill": "G3E_EI_003",
      "token": "text_evidence"
    },
    {
      "type": "unresolved_prerequisite",
      "skill": "G3E_VL_001",
      "token": "g2_context_clues"
    },
    {
      "type": "unresolved_prerequisite",
      "skill": "G3E_VL_001",
      "token": "comprehension"
    },
    {
      "type": "unresolved_prerequisite",
      "skill": "G3E_VL_002",
      "token": "vocabulary"
    },
    {
      "type": "unresolved_prerequisite",
      "skill": "G3E_VL_002",
      "token": "basic_inference"
    },
    {
      "type": "unresolved_prerequisite",
      "skill": "G3E_VL_003",
      "token": "context_clues"
    },
    {
      "type": "unresolved_prerequisite",
      "skill": "G3E_VL_003",
      "token": "reading_exposure"
    },
    {
      "type": "unresolved_prerequisite",
      "skill": "G3E_WG_001",
      "token": "g2_paragraph"
    },
    {
      "type": "unresolved_prerequisite",
      "skill": "G3E_WG_001",
      "token": "oral_expression"
    },
    {
      "type": "unresolved_prerequisite",
      "skill": "G3E_WG_002",
      "token": "paragraph_writing"
    },
    {
      "type": "unresolved_prerequisite",
      "skill": "G3E_WG_002",
      "token": "sentence_control"
    },
    {
      "type": "unresolved_prerequisite",
      "skill": "G3E_WG_003",
      "token": "g2_grammar"
    },
    {
      "type": "unresolved_prerequisite",
      "skill": "G3E_WG_003",
      "token": "writing_basics"
    }
  ],
  "needs_review_count": 16
}
