{
  "graph_file": "curriculum-framework/skill-graphs/grade5/math/graph.v1.json",
  "grade": "grade5",
  "subject": "math",
  "version": "v1",
  "checks": [
    {
      "name": "graph_file_exists",
      "pass": true
    },
    {
      "name": "grade_subject_version_present",
      "pass": true
    },
    {
      "name": "domain_codes_unique",
      "pass": true
    },
    {
      "name": "skill_codes_unique",
      "pass": true
    },
    {
      "name": "required_fields_present",
      "pass": true
    },
    {
      "name": "validation_report_exists",
      "pass": true
    },
    {
      "name": "needs_review_preserved",
      "pass": true
    },
    {
      "name": "no_tracking_scoring_db_logic_added",
      "pass": true
    }
  ],
  "unresolved_prerequisites": [
    {
      "type": "unresolved_prerequisite",
      "skill": "G5M_FR_001",
      "token": "g4_fraction_operations"
    },
    {
      "type": "unresolved_prerequisite",
      "skill": "G5M_FR_001",
      "token": "equivalent_fractions"
    },
    {
      "type": "unresolved_prerequisite",
      "skill": "G5M_FR_002",
      "token": "fraction_meaning"
    },
    {
      "type": "unresolved_prerequisite",
      "skill": "G5M_FR_002",
      "token": "multiplication_understanding"
    },
    {
      "type": "unresolved_prerequisite",
      "skill": "G5M_FR_003",
      "token": "multiply_fractions"
    },
    {
      "type": "unresolved_prerequisite",
      "skill": "G5M_FR_003",
      "token": "division_meaning"
    },
    {
      "type": "unresolved_prerequisite",
      "skill": "G5M_FR_004",
      "token": "fraction_compare"
    },
    {
      "type": "unresolved_prerequisite",
      "skill": "G5M_FR_004",
      "token": "fraction_number_line"
    },
    {
      "type": "unresolved_prerequisite",
      "skill": "G5M_DEC_001",
      "token": "g4_decimals"
    },
    {
      "type": "unresolved_prerequisite",
      "skill": "G5M_DEC_001",
      "token": "place_value"
    },
    {
      "type": "unresolved_prerequisite",
      "skill": "G5M_DEC_002",
      "token": "decimal_place_value"
    },
    {
      "type": "unresolved_prerequisite",
      "skill": "G5M_DEC_002",
      "token": "operation_fluency"
    },
    {
      "type": "unresolved_prerequisite",
      "skill": "G5M_DEC_003",
      "token": "decimal_place_value"
    },
    {
      "type": "unresolved_prerequisite",
      "skill": "G5M_DEC_003",
      "token": "compare_numbers"
    },
    {
      "type": "unresolved_prerequisite",
      "skill": "G5M_VG_001",
      "token": "g4_area"
    },
    {
      "type": "unresolved_prerequisite",
      "skill": "G5M_VG_001",
      "token": "arrays"
    },
    {
      "type": "unresolved_prerequisite",
      "skill": "G5M_VG_001",
      "token": "multiplication"
    },
    {
      "type": "unresolved_prerequisite",
      "skill": "G5M_VG_002",
      "token": "volume_meaning"
    },
    {
      "type": "unresolved_prerequisite",
      "skill": "G5M_VG_002",
      "token": "multiplication_reasoning"
    },
    {
      "type": "unresolved_prerequisite",
      "skill": "G5M_VG_003",
      "token": "grid_reasoning"
    },
    {
      "type": "unresolved_prerequisite",
      "skill": "G5M_VG_003",
      "token": "number_order"
    },
    {
      "type": "unresolved_prerequisite",
      "skill": "G5M_OPS_001",
      "token": "g4_multi_step"
    },
    {
      "type": "unresolved_prerequisite",
      "skill": "G5M_OPS_001",
      "token": "operation_fluency"
    },
    {
      "type": "unresolved_prerequisite",
      "skill": "G5M_OPS_002",
      "token": "g4_modeling"
    },
    {
      "type": "unresolved_prerequisite",
      "skill": "G5M_OPS_002",
      "token": "problem_solving"
    },
    {
      "type": "unresolved_prerequisite",
      "skill": "G5M_OPS_003",
      "token": "multiplication_reasoning"
    },
    {
      "type": "unresolved_prerequisite",
      "skill": "G5M_OPS_003",
      "token": "number_sense"
    },
    {
      "type": "unresolved_prerequisite",
      "skill": "G5M_DG_001",
      "token": "g4_graph_interpretation"
    },
    {
      "type": "unresolved_prerequisite",
      "skill": "G5M_DG_001",
      "token": "comparison_reasoning"
    },
    {
      "type": "unresolved_prerequisite",
      "skill": "G5M_DG_002",
      "token": "g4_create_graphs"
    },
    {
      "type": "unresolved_prerequisite",
      "skill": "G5M_DG_002",
      "token": "data_understanding"
    },
    {
      "type": "unresolved_prerequisite",
      "skill": "G5M_DG_003",
      "token": "graph_interpretation"
    },
    {
      "type": "unresolved_prerequisite",
      "skill": "G5M_DG_003",
      "token": "problem_solving"
    },
    {
      "type": "unresolved_prerequisite",
      "skill": "G5M_MAR_001",
      "token": "g4_explain_reasoning"
    },
    {
      "type": "unresolved_prerequisite",
      "skill": "G5M_MAR_001",
      "token": "problem_solving"
    },
    {
      "type": "unresolved_prerequisite",
      "skill": "G5M_MAR_002",
      "token": "estimation"
    },
    {
      "type": "unresolved_prerequisite",
      "skill": "G5M_MAR_002",
      "token": "operation_reasoning"
    },
    {
      "type": "unresolved_prerequisite",
      "skill": "G5M_MAR_003",
      "token": "mathematical_thinking"
    },
    {
      "type": "unresolved_prerequisite",
      "skill": "G5M_MAR_003",
      "token": "operation_fluency"
    }
  ],
  "needs_review_count": 19
}
