{
  "graph_file": "curriculum-framework/skill-graphs/grade5/reading-english/graph.v1.json",
  "grade": "grade5",
  "subject": "reading-english",
  "version": "v1",
  "checks": [
    {
      "name": "graph_file_exists",
      "pass": true
    },
    {
      "name": "grade_subject_version_present",
      "pass": true
    },
    {
      "name": "domain_codes_unique",
      "pass": true
    },
    {
      "name": "skill_codes_unique",
      "pass": true
    },
    {
      "name": "required_fields_present",
      "pass": true
    },
    {
      "name": "validation_report_exists",
      "pass": true
    },
    {
      "name": "needs_review_preserved",
      "pass": true
    },
    {
      "name": "no_tracking_scoring_db_logic_added",
      "pass": true
    }
  ],
  "unresolved_prerequisites": [
    {
      "type": "unresolved_prerequisite",
      "skill": "G5E_RC_001",
      "token": "g4_summary"
    },
    {
      "type": "unresolved_prerequisite",
      "skill": "G5E_RC_001",
      "token": "g4_text_structure"
    },
    {
      "type": "unresolved_prerequisite",
      "skill": "G5E_RC_002",
      "token": "g4_text_structure"
    },
    {
      "type": "unresolved_prerequisite",
      "skill": "G5E_RC_002",
      "token": "comprehension"
    },
    {
      "type": "unresolved_prerequisite",
      "skill": "G5E_RC_003",
      "token": "g4_compare_texts"
    },
    {
      "type": "unresolved_prerequisite",
      "skill": "G5E_RC_003",
      "token": "analysis"
    },
    {
      "type": "unresolved_prerequisite",
      "skill": "G5E_EI_001",
      "token": "g4_evidence"
    },
    {
      "type": "unresolved_prerequisite",
      "skill": "G5E_EI_001",
      "token": "explain_thinking"
    },
    {
      "type": "unresolved_prerequisite",
      "skill": "G5E_EI_002",
      "token": "g4_inference"
    },
    {
      "type": "unresolved_prerequisite",
      "skill": "G5E_EI_002",
      "token": "theme"
    },
    {
      "type": "unresolved_prerequisite",
      "skill": "G5E_EI_003",
      "token": "advanced_inference"
    },
    {
      "type": "unresolved_prerequisite",
      "skill": "G5E_EI_003",
      "token": "evidence_analysis"
    },
    {
      "type": "unresolved_prerequisite",
      "skill": "G5E_TAC_001",
      "token": "g4_theme"
    },
    {
      "type": "unresolved_prerequisite",
      "skill": "G5E_TAC_001",
      "token": "inference"
    },
    {
      "type": "unresolved_prerequisite",
      "skill": "G5E_TAC_002",
      "token": "g4_author_purpose"
    },
    {
      "type": "unresolved_prerequisite",
      "skill": "G5E_TAC_002",
      "token": "figurative_language"
    },
    {
      "type": "unresolved_prerequisite",
      "skill": "G5E_TAC_003",
      "token": "g4_point_of_view"
    },
    {
      "type": "unresolved_prerequisite",
      "skill": "G5E_TAC_003",
      "token": "author_craft"
    },
    {
      "type": "unresolved_prerequisite",
      "skill": "G5E_VAL_001",
      "token": "g4_academic_vocab"
    },
    {
      "type": "unresolved_prerequisite",
      "skill": "G5E_VAL_001",
      "token": "context_clues"
    },
    {
      "type": "unresolved_prerequisite",
      "skill": "G5E_VAL_002",
      "token": "g4_figurative_language"
    },
    {
      "type": "unresolved_prerequisite",
      "skill": "G5E_VAL_002",
      "token": "inference"
    },
    {
      "type": "unresolved_prerequisite",
      "skill": "G5E_VAL_003",
      "token": "vocabulary_growth"
    },
    {
      "type": "unresolved_prerequisite",
      "skill": "G5E_VAL_003",
      "token": "author_craft"
    },
    {
      "type": "unresolved_prerequisite",
      "skill": "G5E_WG_001",
      "token": "g4_multi_paragraph"
    },
    {
      "type": "unresolved_prerequisite",
      "skill": "G5E_WG_001",
      "token": "organization"
    },
    {
      "type": "unresolved_prerequisite",
      "skill": "G5E_WG_002",
      "token": "essay_organization"
    },
    {
      "type": "unresolved_prerequisite",
      "skill": "G5E_WG_002",
      "token": "evidence_work"
    },
    {
      "type": "unresolved_prerequisite",
      "skill": "G5E_WG_003",
      "token": "g4_editing"
    },
    {
      "type": "unresolved_prerequisite",
      "skill": "G5E_WG_003",
      "token": "sentence_control"
    }
  ],
  "needs_review_count": 15
}
