{
  "graph_file": "curriculum-framework/skill-graphs/grade4/reading-english/graph.v1.json",
  "grade": "grade4",
  "subject": "reading-english",
  "version": "v1",
  "checks": [
    {
      "name": "graph_file_exists",
      "pass": true
    },
    {
      "name": "grade_subject_version_present",
      "pass": true
    },
    {
      "name": "domain_codes_unique",
      "pass": true
    },
    {
      "name": "skill_codes_unique",
      "pass": true
    },
    {
      "name": "required_fields_present",
      "pass": true
    },
    {
      "name": "validation_report_exists",
      "pass": true
    },
    {
      "name": "needs_review_preserved",
      "pass": true
    },
    {
      "name": "no_tracking_scoring_db_logic_added",
      "pass": true
    }
  ],
  "unresolved_prerequisites": [
    {
      "type": "unresolved_prerequisite",
      "skill": "G4E_RC_001",
      "token": "g3_main_idea"
    },
    {
      "type": "unresolved_prerequisite",
      "skill": "G4E_RC_001",
      "token": "g3_summary"
    },
    {
      "type": "unresolved_prerequisite",
      "skill": "G4E_RC_002",
      "token": "summarizing"
    },
    {
      "type": "unresolved_prerequisite",
      "skill": "G4E_RC_002",
      "token": "story_structure"
    },
    {
      "type": "unresolved_prerequisite",
      "skill": "G4E_RC_003",
      "token": "g3_compare_texts"
    },
    {
      "type": "unresolved_prerequisite",
      "skill": "G4E_RC_003",
      "token": "comprehension"
    },
    {
      "type": "unresolved_prerequisite",
      "skill": "G4E_EI_001",
      "token": "g3_text_evidence"
    },
    {
      "type": "unresolved_prerequisite",
      "skill": "G4E_EI_001",
      "token": "comprehension"
    },
    {
      "type": "unresolved_prerequisite",
      "skill": "G4E_EI_002",
      "token": "g3_inference"
    },
    {
      "type": "unresolved_prerequisite",
      "skill": "G4E_EI_002",
      "token": "evidence"
    },
    {
      "type": "unresolved_prerequisite",
      "skill": "G4E_EI_003",
      "token": "evidence_answers"
    },
    {
      "type": "unresolved_prerequisite",
      "skill": "G4E_EI_003",
      "token": "inference"
    },
    {
      "type": "unresolved_prerequisite",
      "skill": "G4E_VL_001",
      "token": "g3_context_clues"
    },
    {
      "type": "unresolved_prerequisite",
      "skill": "G4E_VL_001",
      "token": "academic_vocabulary"
    },
    {
      "type": "unresolved_prerequisite",
      "skill": "G4E_VL_002",
      "token": "g3_figurative_language"
    },
    {
      "type": "unresolved_prerequisite",
      "skill": "G4E_VL_002",
      "token": "inference"
    },
    {
      "type": "unresolved_prerequisite",
      "skill": "G4E_VL_003",
      "token": "vocabulary"
    },
    {
      "type": "unresolved_prerequisite",
      "skill": "G4E_VL_003",
      "token": "reading_experience"
    },
    {
      "type": "unresolved_prerequisite",
      "skill": "G4E_TA_001",
      "token": "inference"
    },
    {
      "type": "unresolved_prerequisite",
      "skill": "G4E_TA_001",
      "token": "story_structure"
    },
    {
      "type": "unresolved_prerequisite",
      "skill": "G4E_TA_002",
      "token": "comprehension"
    },
    {
      "type": "unresolved_prerequisite",
      "skill": "G4E_TA_002",
      "token": "theme"
    },
    {
      "type": "unresolved_prerequisite",
      "skill": "G4E_TA_003",
      "token": "author_purpose"
    },
    {
      "type": "unresolved_prerequisite",
      "skill": "G4E_TA_003",
      "token": "inference"
    },
    {
      "type": "unresolved_prerequisite",
      "skill": "G4E_WG_001",
      "token": "g3_paragraph_writing"
    },
    {
      "type": "unresolved_prerequisite",
      "skill": "G4E_WG_001",
      "token": "organization"
    },
    {
      "type": "unresolved_prerequisite",
      "skill": "G4E_WG_002",
      "token": "multi_paragraph"
    },
    {
      "type": "unresolved_prerequisite",
      "skill": "G4E_WG_002",
      "token": "evidence_work"
    },
    {
      "type": "unresolved_prerequisite",
      "skill": "G4E_WG_003",
      "token": "g3_editing"
    },
    {
      "type": "unresolved_prerequisite",
      "skill": "G4E_WG_003",
      "token": "sentence_control"
    }
  ],
  "needs_review_count": 15
}
