{
  "graph_file": "curriculum-framework/skill-graphs/grade3/math/graph.v1.json",
  "grade": "grade3",
  "subject": "math",
  "version": "v1",
  "checks": [
    {
      "name": "graph_file_exists",
      "pass": true
    },
    {
      "name": "grade_subject_version_present",
      "pass": true
    },
    {
      "name": "domain_codes_unique",
      "pass": true
    },
    {
      "name": "skill_codes_unique",
      "pass": true
    },
    {
      "name": "required_fields_present",
      "pass": true
    },
    {
      "name": "validation_report_exists",
      "pass": true
    },
    {
      "name": "needs_review_preserved",
      "pass": true
    },
    {
      "name": "no_tracking_scoring_db_logic_added",
      "pass": true
    }
  ],
  "unresolved_prerequisites": [
    {
      "type": "unresolved_prerequisite",
      "skill": "G3M_MULT_001",
      "token": "g2_equal_groups"
    },
    {
      "type": "unresolved_prerequisite",
      "skill": "G3M_MULT_001",
      "token": "g2_repeated_addition"
    },
    {
      "type": "unresolved_prerequisite",
      "skill": "G3M_MULT_002",
      "token": "equal_groups"
    },
    {
      "type": "unresolved_prerequisite",
      "skill": "G3M_MULT_002",
      "token": "g2_arrays"
    },
    {
      "type": "unresolved_prerequisite",
      "skill": "G3M_MULT_003",
      "token": "multiplication_meaning"
    },
    {
      "type": "unresolved_prerequisite",
      "skill": "G3M_MULT_003",
      "token": "skip_counting"
    },
    {
      "type": "unresolved_prerequisite",
      "skill": "G3M_MULT_003",
      "token": "arrays"
    },
    {
      "type": "unresolved_prerequisite",
      "skill": "G3M_MULT_004",
      "token": "multiplication_facts"
    },
    {
      "type": "unresolved_prerequisite",
      "skill": "G3M_MULT_004",
      "token": "place_value"
    },
    {
      "type": "unresolved_prerequisite",
      "skill": "G3M_DIV_001",
      "token": "multiplication_meaning"
    },
    {
      "type": "unresolved_prerequisite",
      "skill": "G3M_DIV_001",
      "token": "equal_groups"
    },
    {
      "type": "unresolved_prerequisite",
      "skill": "G3M_DIV_002",
      "token": "multiplication_facts"
    },
    {
      "type": "unresolved_prerequisite",
      "skill": "G3M_DIV_002",
      "token": "division_meaning"
    },
    {
      "type": "unresolved_prerequisite",
      "skill": "G3M_DIV_003",
      "token": "fact_families"
    },
    {
      "type": "unresolved_prerequisite",
      "skill": "G3M_DIV_003",
      "token": "multiplication_facts"
    },
    {
      "type": "unresolved_prerequisite",
      "skill": "G3M_DIV_004",
      "token": "division_facts"
    },
    {
      "type": "unresolved_prerequisite",
      "skill": "G3M_DIV_004",
      "token": "subtraction_reasoning"
    },
    {
      "type": "unresolved_prerequisite",
      "skill": "G3M_FRAC_001",
      "token": "division_meaning"
    },
    {
      "type": "unresolved_prerequisite",
      "skill": "G3M_FRAC_001",
      "token": "shape_partitioning"
    },
    {
      "type": "unresolved_prerequisite",
      "skill": "G3M_FRAC_002",
      "token": "fraction_meaning"
    },
    {
      "type": "unresolved_prerequisite",
      "skill": "G3M_FRAC_003",
      "token": "numerator_denominator"
    },
    {
      "type": "unresolved_prerequisite",
      "skill": "G3M_FRAC_003",
      "token": "number_order"
    },
    {
      "type": "unresolved_prerequisite",
      "skill": "G3M_PS_001",
      "token": "multiplication"
    },
    {
      "type": "unresolved_prerequisite",
      "skill": "G3M_PS_001",
      "token": "division"
    },
    {
      "type": "unresolved_prerequisite",
      "skill": "G3M_PS_001",
      "token": "addition_subtraction"
    },
    {
      "type": "unresolved_prerequisite",
      "skill": "G3M_PS_002",
      "token": "one_step_problems"
    },
    {
      "type": "unresolved_prerequisite",
      "skill": "G3M_PS_002",
      "token": "operation_fluency"
    },
    {
      "type": "unresolved_prerequisite",
      "skill": "G3M_PS_003",
      "token": "multi_step_problems"
    },
    {
      "type": "unresolved_prerequisite",
      "skill": "G3M_PS_003",
      "token": "operation_understanding"
    },
    {
      "type": "unresolved_prerequisite",
      "skill": "G3M_MG_001",
      "token": "arrays"
    },
    {
      "type": "unresolved_prerequisite",
      "skill": "G3M_MG_001",
      "token": "multiplication_meaning"
    },
    {
      "type": "unresolved_prerequisite",
      "skill": "G3M_MG_002",
      "token": "measurement"
    },
    {
      "type": "unresolved_prerequisite",
      "skill": "G3M_MG_002",
      "token": "addition"
    },
    {
      "type": "unresolved_prerequisite",
      "skill": "G3M_MG_002",
      "token": "linear_measure"
    },
    {
      "type": "unresolved_prerequisite",
      "skill": "G3M_MG_003",
      "token": "g2_shapes"
    },
    {
      "type": "unresolved_prerequisite",
      "skill": "G3M_MG_003",
      "token": "shape_attributes"
    },
    {
      "type": "unresolved_prerequisite",
      "skill": "G3M_DG_001",
      "token": "g2_graphs"
    },
    {
      "type": "unresolved_prerequisite",
      "skill": "G3M_DG_001",
      "token": "compare_numbers"
    },
    {
      "type": "unresolved_prerequisite",
      "skill": "G3M_DG_002",
      "token": "read_graphs"
    },
    {
      "type": "unresolved_prerequisite",
      "skill": "G3M_DG_002",
      "token": "data_questions"
    },
    {
      "type": "unresolved_prerequisite",
      "skill": "G3M_DG_003",
      "token": "create_graphs"
    },
    {
      "type": "unresolved_prerequisite",
      "skill": "G3M_DG_003",
      "token": "problem_solving"
    }
  ],
  "needs_review_count": 20
}
