{
  "graph_file": "curriculum-framework/skill-graphs/grade4/math/graph.v1.json",
  "grade": "grade4",
  "subject": "math",
  "version": "v1",
  "checks": [
    {
      "name": "graph_file_exists",
      "pass": true
    },
    {
      "name": "grade_subject_version_present",
      "pass": true
    },
    {
      "name": "domain_codes_unique",
      "pass": true
    },
    {
      "name": "skill_codes_unique",
      "pass": true
    },
    {
      "name": "required_fields_present",
      "pass": true
    },
    {
      "name": "validation_report_exists",
      "pass": true
    },
    {
      "name": "needs_review_preserved",
      "pass": true
    },
    {
      "name": "no_tracking_scoring_db_logic_added",
      "pass": true
    }
  ],
  "unresolved_prerequisites": [
    {
      "type": "unresolved_prerequisite",
      "skill": "G4M_MDO_001",
      "token": "g3_multiplication_facts"
    },
    {
      "type": "unresolved_prerequisite",
      "skill": "G4M_MDO_001",
      "token": "g3_arrays"
    },
    {
      "type": "unresolved_prerequisite",
      "skill": "G4M_MDO_001",
      "token": "place_value"
    },
    {
      "type": "unresolved_prerequisite",
      "skill": "G4M_MDO_002",
      "token": "g3_division"
    },
    {
      "type": "unresolved_prerequisite",
      "skill": "G4M_MDO_002",
      "token": "multiplication_relationship"
    },
    {
      "type": "unresolved_prerequisite",
      "skill": "G4M_MDO_002",
      "token": "place_value"
    },
    {
      "type": "unresolved_prerequisite",
      "skill": "G4M_MDO_003",
      "token": "place_value"
    },
    {
      "type": "unresolved_prerequisite",
      "skill": "G4M_MDO_003",
      "token": "multi_digit_operations"
    },
    {
      "type": "unresolved_prerequisite",
      "skill": "G4M_FR_001",
      "token": "g3_equivalent_fractions"
    },
    {
      "type": "unresolved_prerequisite",
      "skill": "G4M_FR_001",
      "token": "fraction_models"
    },
    {
      "type": "unresolved_prerequisite",
      "skill": "G4M_FR_002",
      "token": "equivalent_fractions"
    },
    {
      "type": "unresolved_prerequisite",
      "skill": "G4M_FR_002",
      "token": "fraction_number_line"
    },
    {
      "type": "unresolved_prerequisite",
      "skill": "G4M_FR_003",
      "token": "compare_fractions"
    },
    {
      "type": "unresolved_prerequisite",
      "skill": "G4M_FR_003",
      "token": "addition_reasoning"
    },
    {
      "type": "unresolved_prerequisite",
      "skill": "G4M_FR_004",
      "token": "fraction_operations"
    },
    {
      "type": "unresolved_prerequisite",
      "skill": "G4M_FR_004",
      "token": "equivalence"
    },
    {
      "type": "unresolved_prerequisite",
      "skill": "G4M_DEC_001",
      "token": "place_value"
    },
    {
      "type": "unresolved_prerequisite",
      "skill": "G4M_DEC_001",
      "token": "fraction_understanding"
    },
    {
      "type": "unresolved_prerequisite",
      "skill": "G4M_DEC_002",
      "token": "tenths_hundredths"
    },
    {
      "type": "unresolved_prerequisite",
      "skill": "G4M_DEC_002",
      "token": "compare_numbers"
    },
    {
      "type": "unresolved_prerequisite",
      "skill": "G4M_PS_001",
      "token": "g3_multi_step"
    },
    {
      "type": "unresolved_prerequisite",
      "skill": "G4M_PS_001",
      "token": "operation_fluency"
    },
    {
      "type": "unresolved_prerequisite",
      "skill": "G4M_PS_002",
      "token": "multi_step_problems"
    },
    {
      "type": "unresolved_prerequisite",
      "skill": "G4M_PS_002",
      "token": "fraction_understanding"
    },
    {
      "type": "unresolved_prerequisite",
      "skill": "G4M_PS_003",
      "token": "mathematical_modeling"
    },
    {
      "type": "unresolved_prerequisite",
      "skill": "G4M_PS_003",
      "token": "problem_solving"
    },
    {
      "type": "unresolved_prerequisite",
      "skill": "G4M_MG_001",
      "token": "g3_area"
    },
    {
      "type": "unresolved_prerequisite",
      "skill": "G4M_MG_001",
      "token": "g3_perimeter"
    },
    {
      "type": "unresolved_prerequisite",
      "skill": "G4M_MG_001",
      "token": "multiplication"
    },
    {
      "type": "unresolved_prerequisite",
      "skill": "G4M_MG_002",
      "token": "shape_attributes"
    },
    {
      "type": "unresolved_prerequisite",
      "skill": "G4M_MG_002",
      "token": "measurement"
    },
    {
      "type": "unresolved_prerequisite",
      "skill": "G4M_MG_003",
      "token": "geometry_foundations"
    },
    {
      "type": "unresolved_prerequisite",
      "skill": "G4M_MG_003",
      "token": "number_order"
    },
    {
      "type": "unresolved_prerequisite",
      "skill": "G4M_DI_001",
      "token": "g3_graphs"
    },
    {
      "type": "unresolved_prerequisite",
      "skill": "G4M_DI_001",
      "token": "compare_numbers"
    },
    {
      "type": "unresolved_prerequisite",
      "skill": "G4M_DI_002",
      "token": "read_graphs"
    },
    {
      "type": "unresolved_prerequisite",
      "skill": "G4M_DI_002",
      "token": "data_questions"
    },
    {
      "type": "unresolved_prerequisite",
      "skill": "G4M_DI_003",
      "token": "create_displays"
    },
    {
      "type": "unresolved_prerequisite",
      "skill": "G4M_DI_003",
      "token": "problem_solving"
    }
  ],
  "needs_review_count": 18
}
