{
  "graph_file": "curriculum-framework/skill-graphs/grade6/reading-english/graph.v1.json",
  "grade": "grade6",
  "subject": "reading-english",
  "version": "v1",
  "checks": [
    {
      "name": "graph_file_exists",
      "pass": true
    },
    {
      "name": "grade_subject_version_present",
      "pass": true
    },
    {
      "name": "domain_codes_unique",
      "pass": true
    },
    {
      "name": "skill_codes_unique",
      "pass": true
    },
    {
      "name": "required_fields_present",
      "pass": true
    },
    {
      "name": "validation_report_exists",
      "pass": true
    },
    {
      "name": "needs_review_preserved",
      "pass": true
    },
    {
      "name": "no_tracking_scoring_db_logic_added",
      "pass": true
    }
  ],
  "unresolved_prerequisites": [
    {
      "type": "unresolved_prerequisite",
      "skill": "G6E_CRC_001",
      "token": "g5_analytical_summary"
    },
    {
      "type": "unresolved_prerequisite",
      "skill": "G6E_CRC_001",
      "token": "main_idea"
    },
    {
      "type": "unresolved_prerequisite",
      "skill": "G6E_CRC_002",
      "token": "g5_text_structure"
    },
    {
      "type": "unresolved_prerequisite",
      "skill": "G6E_CRC_002",
      "token": "analysis"
    },
    {
      "type": "unresolved_prerequisite",
      "skill": "G6E_CRC_003",
      "token": "g5_compare_texts"
    },
    {
      "type": "unresolved_prerequisite",
      "skill": "G6E_CRC_003",
      "token": "analysis"
    },
    {
      "type": "unresolved_prerequisite",
      "skill": "G6E_ELA_001",
      "token": "g5_evidence_analysis"
    },
    {
      "type": "unresolved_prerequisite",
      "skill": "G6E_ELA_001",
      "token": "close_reading"
    },
    {
      "type": "unresolved_prerequisite",
      "skill": "G6E_ELA_002",
      "token": "theme"
    },
    {
      "type": "unresolved_prerequisite",
      "skill": "G6E_ELA_002",
      "token": "inference"
    },
    {
      "type": "unresolved_prerequisite",
      "skill": "G6E_ELA_002",
      "token": "evidence"
    },
    {
      "type": "unresolved_prerequisite",
      "skill": "G6E_ELA_003",
      "token": "g5_inference"
    },
    {
      "type": "unresolved_prerequisite",
      "skill": "G6E_ELA_003",
      "token": "literary_analysis"
    },
    {
      "type": "unresolved_prerequisite",
      "skill": "G6E_AP_001",
      "token": "g5_claim_evidence"
    },
    {
      "type": "unresolved_prerequisite",
      "skill": "G6E_AP_001",
      "token": "text_evidence"
    },
    {
      "type": "unresolved_prerequisite",
      "skill": "G6E_AP_002",
      "token": "g5_perspective"
    },
    {
      "type": "unresolved_prerequisite",
      "skill": "G6E_AP_002",
      "token": "author_craft"
    },
    {
      "type": "unresolved_prerequisite",
      "skill": "G6E_AP_003",
      "token": "argument_structure"
    },
    {
      "type": "unresolved_prerequisite",
      "skill": "G6E_AP_003",
      "token": "perspective"
    },
    {
      "type": "unresolved_prerequisite",
      "skill": "G6E_VAL_001",
      "token": "g5_academic_vocab"
    },
    {
      "type": "unresolved_prerequisite",
      "skill": "G6E_VAL_001",
      "token": "context_clues"
    },
    {
      "type": "unresolved_prerequisite",
      "skill": "G6E_VAL_002",
      "token": "g5_figurative_language"
    },
    {
      "type": "unresolved_prerequisite",
      "skill": "G6E_VAL_002",
      "token": "author_craft"
    },
    {
      "type": "unresolved_prerequisite",
      "skill": "G6E_VAL_003",
      "token": "figurative_language"
    },
    {
      "type": "unresolved_prerequisite",
      "skill": "G6E_VAL_003",
      "token": "author_analysis"
    },
    {
      "type": "unresolved_prerequisite",
      "skill": "G6E_WRL_001",
      "token": "g5_opinion_essay"
    },
    {
      "type": "unresolved_prerequisite",
      "skill": "G6E_WRL_001",
      "token": "argument_structure"
    },
    {
      "type": "unresolved_prerequisite",
      "skill": "G6E_WRL_002",
      "token": "essay_organization"
    },
    {
      "type": "unresolved_prerequisite",
      "skill": "G6E_WRL_002",
      "token": "evidence_analysis"
    },
    {
      "type": "unresolved_prerequisite",
      "skill": "G6E_WRL_003",
      "token": "compare_texts"
    },
    {
      "type": "unresolved_prerequisite",
      "skill": "G6E_WRL_003",
      "token": "informational_writing"
    }
  ],
  "needs_review_count": 15
}
